{
  "$schema": "../spec/training-plan.schema.json",
  "specVersion": 1,
  "id": "heliski-2027",
  "title": "Heliski Canada",
  "subtitle": "18-week indoor plan · 30 min Mon–Fri",
  "description": "8–10 runs a day for 7 days is won or lost on day 4+. The plan builds eccentric quad endurance, single-leg strength and an engine, then tapers so you arrive fresh.",
  "startDate": "2026-09-14",
  "notes": [
    "Every session fits in 30 minutes including warm-up and finish. Weekends free.",
    "After a 5-day hotel week, make the next home week's Mon/Wed heavy-backpack days and Tue longer; do not try to make up volume inside the hotel week.",
    "Backpack: on the back for split squats, step-ups, step-downs, calf raises, lunges; on the thighs for wall sits; across the hips for bridges; never on jumps, hops or sprints.",
    "Sunday check (60 s): 5 sessions done? Backpack kg, wall-sit seconds or circuit rounds higher than 3 weeks ago? Two flat weeks in a row means the plan changes.",
    "Same session, same load, RPE dropping over 3 weeks: add load. RPE rising at the same load: you are under-recovered, no extra load.",
    "RPE 1–10: 3–4 easy, could chat · 6–7 hard, 2–3 reps left · 8 very hard, 1 rep left · 9–10 failure (not in this plan)."
  ],
  "equipment": {
    "backpack": { "name": "Backpack 8–15 kg", "description": "Filled with water bottles or books." },
    "chair": { "name": "Sturdy chair", "description": "Test it first. Bed edge works for split squats." },
    "wall": { "name": "Wall" },
    "stairs": { "name": "Stairwell / bench", "description": "2 stairs or a bench for step-ups and step-downs." },
    "rowerg": { "name": "RowErg" }
  },
  "environments": [
    {
      "id": "home",
      "name": "Home",
      "description": "Backpack · stairwell · RowErg.",
      "equipment": ["backpack", "chair", "wall", "stairs", "rowerg"]
    },
    {
      "id": "travel",
      "name": "Hotel",
      "description": "Bodyweight, everything in the room.",
      "equipment": ["chair", "wall"]
    }
  ],
  "phases": [
    {
      "id": "p1",
      "name": "Foundation",
      "weeks": [1, 4],
      "focus": "Movement quality, controlled tempo, 2 reps short of failure.",
      "notes": "Bodyweight or 8 kg. 60 s rest. Wall sit 45 s. Circuit 3 rounds."
    },
    {
      "id": "p2",
      "name": "Strength-endurance",
      "weeks": [5, 10],
      "focus": "Density up: same 4 rounds, rest cut to 30 s, 3 s eccentrics everywhere.",
      "notes": "Pack 10–12 kg. Wall sit 60 s in week 5, +15 s per week, max 2 min. Circuit 4 rounds. Pistol progression."
    },
    {
      "id": "p3",
      "name": "Power + fatigue resistance",
      "weeks": [11, 16],
      "focus": "Plyometrics, working while already tired. Wed–Thu–Fri deliberately back-to-back.",
      "notes": "Pack 15 kg on strength moves only. Jump lunges, hops, tuck jumps. Wall sit 3 min or single-leg. Circuit 4 rounds, 30 s rest. Strongly recommended: 3–4 resort ski days in December."
    },
    {
      "id": "p4",
      "name": "Taper",
      "weeks": [17, 18],
      "focus": "Arrive fresh, not \"one more workout\" tired.",
      "notes": "3 rounds or fewer, same intensity, nothing new. Last hard session about 5 days before the first flight."
    }
  ],
  "exercises": {
    "jumping-jacks": { "name": "Jumping jacks" },
    "leg-swings": { "name": "Leg swings", "instructions": "Front-to-back, hold a wall or chair for balance." },
    "air-squat": { "name": "Air squats", "instructions": "Slow and controlled, full depth, heels down." },
    "lunge": { "name": "Lunges" },
    "single-leg-balance": { "name": "Single-leg balance", "instructions": "Stand on one leg, soft knee, hips level." },
    "hip-circles": { "name": "Hip circles" },
    "marching": { "name": "Marching in place" },
    "easy-movement": {
      "name": "Easy in-room movement",
      "instructions": "Marching, step-jacks, slow chair step-ups. RPE 3–4, you can talk the whole time.",
      "equipment": ["chair"]
    },
    "bulgarian-split-squat": {
      "name": "Bulgarian split squat",
      "instructions": "Rear foot on chair/bed. 3 s down, 1 s up. Front knee over the foot, torso upright. Home: backpack on the back.",
      "cues": ["3 s down, 1 s up", "Front knee over the foot", "Torso upright"],
      "equipment": ["chair"],
      "media": [{ "type": "image", "alt": "Bulgarian split squat (figure from the PDF)", "src": "data:image/svg+xml;base64,PHN2ZyB4bWxucz0iaHR0cDovL3d3dy53My5vcmcvMjAwMC9zdmciIHZpZXdCb3g9IjAgMCA5My4yIDcxLjEiIHN0cm9rZS1saW5lY2FwPSJyb3VuZCIgc3Ryb2tlLWxpbmVqb2luPSJyb3VuZCI+PHBhdGggZD0iTTIwLjMgNjcuMUwzNS4xIDY3LjFMMzUuMSA0My40TDIwLjMgNDMuNFoiIGZpbGw9IiNmMmYyZjIiIHN0cm9rZT0iIzhhOGE4YSIgc3Ryb2tlLXdpZHRoPSIwLjgiIGZpbGwtcnVsZT0iZXZlbm9kZCIvPjxwYXRoIGQ9Ik00MyAyOC42TDQ1IDI4LjZDNDUuNyAyOC42IDQ2LjIgMjguMSA0Ni4yIDI3LjRMNDYuMiAxNy45QzQ2LjIgMTcuMyA0NS43IDE2LjcgNDUgMTYuN0w0MyAxNi43QzQyLjMgMTYuNyA0MS44IDE3LjMgNDEuOCAxNy45TDQxLjggMjcuNEM0MS44IDI4LjEgNDIuMyAyOC42IDQzIDI4LjZaIiBmaWxsPSIjYzU1YTExIiBmaWxsLXJ1bGU9ImV2ZW5vZGQiLz48cGF0aCBkPSJNNCA2Ny4xTDg5LjIgNjcuMSIgZmlsbD0ibm9uZSIgc3Ryb2tlPSIjOGE4YThhIiBzdHJva2Utd2lkdGg9IjAuOCIvPjxwYXRoIGQ9Ik00OC41IDM2TDM4LjEgNTIuMyIgZmlsbD0ibm9uZSIgc3Ryb2tlPSIjYTZhNmE2IiBzdHJva2Utd2lkdGg9IjEuNiIvPjxwYXRoIGQ9Ik0zOC4xIDUyLjNMMzAuNyA0My40IiBmaWxsPSJub25lIiBzdHJva2U9IiNhNmE2YTYiIHN0cm9rZS13aWR0aD0iMS42Ii8+PHBhdGggZD0iTTMwLjcgNDMuNEwyNy43IDM5IiBmaWxsPSJub25lIiBzdHJva2U9IiNhNmE2YTYiIHN0cm9rZS13aWR0aD0iMS42Ii8+PHBhdGggZD0iTTQ4LjUgMTMuOEw0OC41IDM2IiBmaWxsPSJub25lIiBzdHJva2U9IiMwMDAwMDAiIHN0cm9rZS13aWR0aD0iMiIvPjxwYXRoIGQ9Ik00OC41IDM2TDU3LjMgNTAuOCIgZmlsbD0ibm9uZSIgc3Ryb2tlPSIjMDAwMDAwIiBzdHJva2Utd2lkdGg9IjEuOCIvPjxwYXRoIGQ9Ik01Ny4zIDUwLjhMNTcuMyA2NC45IiBmaWxsPSJub25lIiBzdHJva2U9IiMwMDAwMDAiIHN0cm9rZS13aWR0aD0iMS44Ii8+PHBhdGggZD0iTTU3LjMgNjQuOUw2My4zIDY0LjkiIGZpbGw9Im5vbmUiIHN0cm9rZT0iIzAwMDAwMCIgc3Ryb2tlLXdpZHRoPSIxLjgiLz48cGF0aCBkPSJNNDguNSAxNi43TDU0LjQgMjQuMiIgZmlsbD0ibm9uZSIgc3Ryb2tlPSIjMDAwMDAwIiBzdHJva2Utd2lkdGg9IjEuOCIvPjxwYXRoIGQ9Ik01NC40IDI0LjJMNTEuNCAzMS42IiBmaWxsPSJub25lIiBzdHJva2U9IiMwMDAwMDAiIHN0cm9rZS13aWR0aD0iMS44Ii8+PHBhdGggZD0iTTUyLjMgNy45QzUyLjMgNS43IDUwLjYgNCA0OC41IDRDNDYuMyA0IDQ0LjYgNS43IDQ0LjYgNy45QzQ0LjYgMTAgNDYuMyAxMS43IDQ4LjUgMTEuN0M1MC42IDExLjcgNTIuMyAxMCA1Mi4zIDcuOSIgZmlsbD0iIzAwMDAwMCIgZmlsbC1ydWxlPSJldmVub2RkIi8+PHBhdGggZD0iTTY3LjcgMzMuOEw2Ny43IDQ0LjkiIGZpbGw9Im5vbmUiIHN0cm9rZT0iI2M1NWExMSIgc3Ryb2tlLXdpZHRoPSIxIi8+PHBhdGggZD0iTTY3LjcgNDQuOUw2NS41IDQwLjkiIGZpbGw9Im5vbmUiIHN0cm9rZT0iI2M1NWExMSIgc3Ryb2tlLXdpZHRoPSIxIi8+PHBhdGggZD0iTTY3LjcgNDQuOUw2OS45IDQwLjkiIGZpbGw9Im5vbmUiIHN0cm9rZT0iI2M1NWExMSIgc3Ryb2tlLXdpZHRoPSIxIi8+PC9zdmc+" }]
    },
    "step-up": {
      "name": "Step-up",
      "instructions": "Onto a chair (hotel) or 2 stairs/bench (home). Drive through the TOP leg, no push-off from the floor. Lower slowly.",
      "cues": ["Drive through the top leg", "No push-off from the floor", "Lower slowly"],
      "equipment": ["chair"],
      "media": [{ "type": "image", "alt": "Step-up (figure from the PDF)", "src": "data:image/svg+xml;base64,PHN2ZyB4bWxucz0iaHR0cDovL3d3dy53My5vcmcvMjAwMC9zdmciIHZpZXdCb3g9IjAgMCA4MS41IDcxLjQiIHN0cm9rZS1saW5lY2FwPSJyb3VuZCIgc3Ryb2tlLWxpbmVqb2luPSJyb3VuZCI+PHBhdGggZD0iTTQ4LjcgNjcuNEw3MC41IDY3LjRMNzAuNSA1NS45TDQ4LjcgNTUuOVoiIGZpbGw9IiNmMmYyZjIiIHN0cm9rZT0iIzhhOGE4YSIgc3Ryb2tlLXdpZHRoPSIwLjgiIGZpbGwtcnVsZT0iZXZlbm9kZCIvPjxwYXRoIGQ9Ik00NC44IDI1LjJMNDYuMyAyNS4yQzQ2LjkgMjUuMiA0Ny41IDI0LjcgNDcuNSAyNEw0Ny41IDE2LjJDNDcuNSAxNS41IDQ2LjkgMTUgNDYuMyAxNUw0NC44IDE1QzQ0LjIgMTUgNDMuNiAxNS41IDQzLjYgMTYuMkw0My42IDI0QzQzLjYgMjQuNyA0NC4yIDI1LjIgNDQuOCAyNS4yWiIgZmlsbD0iI2M1NWExMSIgZmlsbC1ydWxlPSJldmVub2RkIi8+PHBhdGggZD0iTTQgNjcuNEw3Ny41IDY3LjQiIGZpbGw9Im5vbmUiIHN0cm9rZT0iIzhhOGE4YSIgc3Ryb2tlLXdpZHRoPSIwLjgiLz48cGF0aCBkPSJNNDcuNSAzMC4zTDQxLjEgNDUuNyIgZmlsbD0ibm9uZSIgc3Ryb2tlPSIjYTZhNmE2IiBzdHJva2Utd2lkdGg9IjEuNiIvPjxwYXRoIGQ9Ik00MS4xIDQ1LjdMMzguNSA2NS41IiBmaWxsPSJub25lIiBzdHJva2U9IiNhNmE2YTYiIHN0cm9rZS13aWR0aD0iMS42Ii8+PHBhdGggZD0iTTM4LjUgNjUuNUw0My42IDY1LjUiIGZpbGw9Im5vbmUiIHN0cm9rZT0iI2E2YTZhNiIgc3Ryb2tlLXdpZHRoPSIxLjYiLz48cGF0aCBkPSJNNTAuNyAxMi40TDQ3LjUgMzAuMyIgZmlsbD0ibm9uZSIgc3Ryb2tlPSIjMDAwMDAwIiBzdHJva2Utd2lkdGg9IjIiLz48cGF0aCBkPSJNNDcuNSAzMC4zTDUzLjkgNDEuOCIgZmlsbD0ibm9uZSIgc3Ryb2tlPSIjMDAwMDAwIiBzdHJva2Utd2lkdGg9IjEuOCIvPjxwYXRoIGQ9Ik01My45IDQxLjhMNTMuOSA1NS45IiBmaWxsPSJub25lIiBzdHJva2U9IiMwMDAwMDAiIHN0cm9rZS13aWR0aD0iMS44Ii8+PHBhdGggZD0iTTUzLjkgNTUuOUw2MC4yIDU1LjkiIGZpbGw9Im5vbmUiIHN0cm9rZT0iIzAwMDAwMCIgc3Ryb2tlLXdpZHRoPSIxLjgiLz48cGF0aCBkPSJNNTAgMTVMNTUuMSAyMi43IiBmaWxsPSJub25lIiBzdHJva2U9IiMwMDAwMDAiIHN0cm9rZS13aWR0aD0iMS44Ii8+PHBhdGggZD0iTTU1LjEgMjIuN0w1MS4zIDI5LjEiIGZpbGw9Im5vbmUiIHN0cm9rZT0iIzAwMDAwMCIgc3Ryb2tlLXdpZHRoPSIxLjgiLz48cGF0aCBkPSJNNTQuNiA3LjNDNTQuNiA1LjUgNTMuMSA0IDUxLjMgNEM0OS41IDQgNDggNS41IDQ4IDcuM0M0OCA5LjIgNDkuNSAxMC42IDUxLjMgMTAuNkM1My4xIDEwLjYgNTQuNiA5LjIgNTQuNiA3LjMiIGZpbGw9IiMwMDAwMDAiIGZpbGwtcnVsZT0iZXZlbm9kZCIvPjxwYXRoIGQ9Ik02NS40IDQxLjhMNjUuNCAzMC4zIiBmaWxsPSJub25lIiBzdHJva2U9IiNjNTVhMTEiIHN0cm9rZS13aWR0aD0iMSIvPjxwYXRoIGQ9Ik02NS40IDMwLjNMNjcuNSAzNC4zIiBmaWxsPSJub25lIiBzdHJva2U9IiNjNTVhMTEiIHN0cm9rZS13aWR0aD0iMSIvPjxwYXRoIGQ9Ik02NS40IDMwLjNMNjMuMiAzNC4zIiBmaWxsPSJub25lIiBzdHJva2U9IiNjNTVhMTEiIHN0cm9rZS13aWR0aD0iMSIvPjwvc3ZnPg==" }]
    },
    "single-leg-glute-bridge": {
      "name": "Single-leg glute bridge",
      "instructions": "Heels close to the glutes, lower back flat, push through the heel. 1 s squeeze at the top, hips level. Never with the pack on the back; home from phase 2 across the hips.",
      "cues": ["Push through the heel", "1 s squeeze at the top", "Hips level"],